{
  "status": "ok",
  "monthLabel": "Octubre 2026",
  "weekdayLabels": [
    "Lun",
    "Mar",
    "Mié",
    "Jue",
    "Vie",
    "Sáb",
    "Dom"
  ],
  "cells": [
    {
      "day": 28,
      "inMonth": false,
      "isToday": false,
      "hasEvents": false
    },
    {
      "day": 29,
      "inMonth": false,
      "isToday": false,
      "hasEvents": false
    },
    {
      "day": 30,
      "inMonth": false,
      "isToday": false,
      "hasEvents": false
    },
    {
      "day": 1,
      "inMonth": true,
      "isToday": false,
      "hasEvents": false
    },
    {
      "day": 2,
      "inMonth": true,
      "isToday": false,
      "hasEvents": false
    },
    {
      "day": 3,
      "inMonth": true,
      "isToday": false,
      "hasEvents": false
    },
    {
      "day": 4,
      "inMonth": true,
      "isToday": false,
      "hasEvents": false
    },
    {
      "day": 5,
      "inMonth": true,
      "isToday": false,
      "hasEvents": false
    },
    {
      "day": 6,
      "inMonth": true,
      "isToday": false,
      "hasEvents": false
    },
    {
      "day": 7,
      "inMonth": true,
      "isToday": false,
      "hasEvents": false
    },
    {
      "day": 8,
      "inMonth": true,
      "isToday": false,
      "hasEvents": false
    },
    {
      "day": 9,
      "inMonth": true,
      "isToday": false,
      "hasEvents": false
    },
    {
      "day": 10,
      "inMonth": true,
      "isToday": false,
      "hasEvents": false
    },
    {
      "day": 11,
      "inMonth": true,
      "isToday": false,
      "hasEvents": false
    },
    {
      "day": 12,
      "inMonth": true,
      "isToday": false,
      "hasEvents": false
    },
    {
      "day": 13,
      "inMonth": true,
      "isToday": false,
      "hasEvents": false
    },
    {
      "day": 14,
      "inMonth": true,
      "isToday": false,
      "hasEvents": false
    },
    {
      "day": 15,
      "inMonth": true,
      "isToday": true,
      "hasEvents": true
    },
    {
      "day": 16,
      "inMonth": true,
      "isToday": false,
      "hasEvents": true
    },
    {
      "day": 17,
      "inMonth": true,
      "isToday": false,
      "hasEvents": false
    },
    {
      "day": 18,
      "inMonth": true,
      "isToday": false,
      "hasEvents": false
    },
    {
      "day": 19,
      "inMonth": true,
      "isToday": false,
      "hasEvents": false
    },
    {
      "day": 20,
      "inMonth": true,
      "isToday": false,
      "hasEvents": true
    },
    {
      "day": 21,
      "inMonth": true,
      "isToday": false,
      "hasEvents": false
    },
    {
      "day": 22,
      "inMonth": true,
      "isToday": false,
      "hasEvents": false
    },
    {
      "day": 23,
      "inMonth": true,
      "isToday": false,
      "hasEvents": true
    },
    {
      "day": 24,
      "inMonth": true,
      "isToday": false,
      "hasEvents": false
    },
    {
      "day": 25,
      "inMonth": true,
      "isToday": false,
      "hasEvents": false
    },
    {
      "day": 26,
      "inMonth": true,
      "isToday": false,
      "hasEvents": false
    },
    {
      "day": 27,
      "inMonth": true,
      "isToday": false,
      "hasEvents": true
    },
    {
      "day": 28,
      "inMonth": true,
      "isToday": false,
      "hasEvents": false
    },
    {
      "day": 29,
      "inMonth": true,
      "isToday": false,
      "hasEvents": false
    },
    {
      "day": 30,
      "inMonth": true,
      "isToday": false,
      "hasEvents": false
    },
    {
      "day": 31,
      "inMonth": true,
      "isToday": false,
      "hasEvents": false
    },
    {
      "day": 1,
      "inMonth": false,
      "isToday": false,
      "hasEvents": false
    }
  ],
  "selectedDay": {
    "title": "Hoy",
    "dateLabel": "Jue 15 oct",
    "items": [
      {
        "id": "ev-1",
        "kind": "event",
        "title": "Revisión médica",
        "timeLabel": "10:00",
        "departure": {
          "placeLabel": "Centro de salud",
          "travelMinutes": 18,
          "leaveAt": "09:32"
        }
      },
      {
        "id": "ev-2",
        "kind": "event",
        "title": "Reunión de equipo",
        "timeLabel": "12:30"
      },
      {
        "id": "ev-3",
        "kind": "event",
        "title": "Clase de inglés",
        "timeLabel": "18:00"
      },
      {
        "id": "rem-1",
        "kind": "reminder",
        "title": "Comprar pan"
      }
    ]
  }
}
